program_id,school_name,city,state,program_url,url_status,search_attempts,url_confidence,fact_sheet_url,search_query_used,scrape_notes,estimated_year,validation_status,rejection_reason,total_program_cost,data_year,tuition_per_year,fees_per_year,rediscovery_status,apta_program_url,outcomes_url,extracted_from_url,graduation_rate_pct,board_pass_rate_pct,employment_rate_pct,apta_landing_confirmed,program_length_months,extraction_notes
131,Allen College,,Iowa,https://www.allencollege.edu/doctor-of-physical-therapy.aspx,url_found,3,high,https://www.allencollege.edu/filesimages/PagePDFs/Fin%20Aid/DPT%20Financial%20Fact%20Sheet.pdf,Allen College DPT financial fact sheet,,,valid,,117731,2026-2027,,,,https://www.allencollege.edu/doctor-of-physical-therapy.aspx,https://www.allencollege.edu/our-programs/school-of-health-sciences/doctor-of-physical-therapy,,,,,,,
130,Briar Cliff University,,Iowa,https://www.briarcliff.edu/current-chargers/academics/doctor-of-physical-therapy,url_found,3,high,https://www.briarcliff.edu/filesimages/Current%20Chargers/Academics/Graduate%20Programs/Doctor%20of%20Physical%20Therapy/2025-dpt-student-financial-fact-sheet.pdf,Briar Cliff University DPT financial fact sheet,,2025,valid,,104030,2025,33000,0,,https://www.briarcliff.edu/current-chargers/academics/doctor-of-physical-therapy,https://www.briarcliff.edu/current-chargers/academics/doctor-of-physical-therapy,,,,,,,
129,Clarke University,,Iowa,https://www.clarke.edu/academics/doctor-of-physical-therapy/,url_found,3,high,https://clarke.edu/wp-content/uploads/2025/12/Clarke-University-2024-2025-DPT-Student-Financial-Fact-Sheet-1-1.pdf,Clarke University DPT financial fact sheet,,2025,valid,,,2024-2025,,,,https://www.clarke.edu/academics/doctor-of-physical-therapy/,https://www.clarke.edu/academics/doctor-of-physical-therapy/doctor-physical-therapy-mission-outcomes/,,,,,,,
127,Des Moines University - Osteopathic Medical Center,,Iowa,http://www.dmu.edu/pt/,url_found,3,high,https://andersonuniversity.edu/wp-content/uploads/2018/09/2021-2022-DPT-student-financial-fact-sheet.pdf,Des Moines University - Osteopathic Medical Center DPT financial fact sheet,,2018,fetch_failed,no_url,,,,,,http://www.dmu.edu/pt/,https://www.dmu.edu/pt/program-outcomes/,,,,,,,
128,St Ambrose University,,Iowa,www.sau.edu/pt,url_found,3,high,https://sau.edu/media/content-assets/pdfs/academics/doctoral-programs/Orthopaedic-Residency-and-Fellowship-Financial-Fact-Sheet.pdf,St Ambrose University DPT financial fact sheet,,,fetch_failed,no_url,,,,,,www.sau.edu/pt,www.sau.edu/pt,,,,,,,
126,University of lowa,,Iowa,pt.medicine.uiowa.edu,url_found,3,high,https://www.unlv.edu/sites/default/files/media/document/2023-11/UNLV-DPT-Financial-Factsheet-2023.pdf,University of lowa DPT financial fact sheet,,2023,fetch_failed,no_url,,,,,,pt.medicine.uiowa.edu,pt.medicine.uiowa.edu/education/doctor-physical-therapy-program,,,,,,,
132,University of Kansas Medical Center,,Kansas,https://www.kumc.edu/school-of-health-professions/academics/departments/physical-therapy-rehabilitation-science-and-athletic-training/academics/doctor-of-physical-therapy.htmlademics/doctor-of-physical-therapy.html?=redirect,url_found,3,high,https://assets-002.noviams.com/novi-file-uploads/apta-aoe/Resources/DPT_and_PTA_Financial_Fact_Sheets_42320-6d3ec8e3.pdf,University of Kansas Medical Center DPT financial fact sheet,,,confirmed_landing,"This is a landing/overview page for the University of Kansas Medical Center DPT program. While it mentions '>98% Graduation rate, ultimate exam pass rate and employment rate' in a summary statement, it does not provide specific numerical values for these metrics or any financial data (tuition, fees, total program cost). The page references a 'Costs & Financial Aid' link but does not contain the actual financial information. Specific outcome data and financial details are on linked sub-pages, not on this page itself.",,,,,,https://www.kumc.edu/school-of-health-professions/academics/departments/physical-therapy-rehabilitation-science-and-athletic-training/academics/doctor-of-physical-therapy.htmlademics/doctor-of-physical-therapy.html?=redirect,https://www.kumc.edu/school-of-health-professions/academics/departments/physical-therapy-rehabilitation-science-and-athletic-training/academics/doctor-of-physical-therapy/accreditation-and-outcomes.html,,,,,,,
134,University of Saint Mary,,Kansas,http://www.stmary.edu/dpt,url_found,3,high,https://www.umary.edu/sites/default/files/2022-07/DPT-student-financial-fact-sheet.pdf,University of Saint Mary DPT financial fact sheet,,2022,valid,,104231,2025,34295,3684,,http://www.stmary.edu/dpt,http://www.stmary.edu/dptoutcomes,,,,,,,
133,Wichita State University,,Kansas,https://www.wichita.edu/pt,url_found,3,high,https://franklinpierce.edu/academics/programs/physical-therapy/2024-25-DPT-FPU-NH-Financial-fact-sheet.pdf,Wichita State University DPT financial fact sheet,,2024,confirmed_landing,"This is the correct school's DPT program landing/overview page, but it does not contain specific financial data (tuition, fees, total cost) or quantifiable outcome data (graduation rate, board pass rate, employment rate). While it mentions 'robust graduate outcomes' and that pass rates 'consistently meet or exceed national averages,' no actual percentages or dollar amounts are provided. The data appears to be on linked sub-pages (Admissions, program details, etc.) rather than on this page itself.",,,,,,https://www.wichita.edu/pt,https://www.wichita.edu/academics/health_professions/pt/aboutpt.php,,,,,,,
136,Bellarmine University,,Kentucky,https://www.bellarmine.edu/health-professions/graduate/doctor-of-physical-therapy/,url_found,3,high,https://www.bellarmine.edu/docs/default-source/default-document-library/residency-and-fellowship-financial-fact-sheet-10-3065682d97fcf16c298b1dff00007f963e.pdf?sfvrsn=5c994180_0,Bellarmine University DPT financial fact sheet,,,confirmed_landing,"This is the correct school's DPT program landing page, but it contains no financial or outcome data. The page mentions 'Financial Fact Sheet' and 'Tuition and Fees' in the navigation menu as separate links, indicating that the actual data is on linked sub-pages, not on this page itself.",,,,,,https://www.bellarmine.edu/health-professions/graduate/doctor-of-physical-therapy/,https://www.bellarmine.edu/health-professions/graduate/doctor-of-physical-therapy/outcomes/,,,,,,,
135,University of Kentucky,,Kentucky,,url_found,3,high,https://chs.uky.edu/sites/default/files/2024-08/2023-2024-dpt-student-financial-fact-sheet.pdf,University of Kentucky DPT financial fact sheet,,2024,valid,,72897,2023-2024,22225,1574,,,,,,,,,,
138,University of the Cumberlands,,Kentucky,https://www.ucumberlands.edu/academics/graduate/doctor-physical-therapy-dpt,url_found,3,high,https://acapt.org/docs/default-source/default-document-library/doctor-of-physical-therapy-program-financial-fact-sheet-2020-2021.pdf?sfvrsn=46538fd8_2,University of the Cumberlands DPT financial fact sheet,,2020,confirmed_landing,"Page contains program overview and admission information but lacks financial details (tuition cost per year, total program cost, fees breakdown) and outcome metrics (graduation rate, board pass rate, employment rate). While cost per credit hour ($700/credit hour) and average salary ($97,720) are mentioned, specific tuition per year, fees per year, total program cost, and outcome rates are not provided.",,,,,,https://www.ucumberlands.edu/academics/graduate/doctor-physical-therapy-dpt,https://www.ucumberlands.edu/academics/graduate/doctor-physical-therapy-dpt,,,,,,,
137,Western Kentucky University,,Kentucky,http://www.wku.edu/physicaltherapy/,url_found,3,high,https://www.wku.edu/physicaltherapy/2024-dpt-student-financial-fact-sheet.pdf,Western Kentucky University DPT financial fact sheet,,2024,valid,,80445,2024,,1538,,http://www.wku.edu/physicaltherapy/,https://www.wku.edu/physicaltherapy/cost_estimate.php,,,,,True,,
141,Franciscan Missionaries of Our Lady University,,Louisiana,https://franu.edu/academics/programs/dpt/index.html,url_found,3,high,https://www.slu.edu/doisy/degrees/-pdf/pt-residency-financial-factsheet.pdf,Franciscan Missionaries of Our Lady University DPT financial fact sheet,,,confirmed_landing,"This is the correct school and DPT program overview page, but financial data (tuition, fees, total program cost) is absent. The page does contain some outcome data: employment rate 100%, graduation rate goal >85%, and board pass rate 84.4% initial and 99% ultimate, but lacks the critical financial information needed for a complete fact sheet. The page mentions 'Admissions, Tuition and Financial Aid Information' as a section header but the actual tuition and fees details are not included in the provided content - they appear to be on a linked sub-page.",,,,,,https://franu.edu/academics/programs/dpt/index.html,https://franu.edu/academics/academic-programs/physical-therapy,,,84.4,100.0,,,
140,Louisiana State Univ Health Sciences Center -  Shreveport,,Louisiana,https://shps.lsuhs.edu/academics/graduate-programs/doctor-physical-therapy,url_found,3,high,https://www.sbuniv.edu/_resources/documents/health-professions/dpt-financial-fact-sheet.pdf,Louisiana State Univ Health Sciences Center -  Shreveport DPT financial fact sheet,,,confirmed_landing,"This is the correct school's DPT program landing/overview page, but it does not contain the specific financial or outcome data requested. While the page mentions 'Financial Fact Sheet' as a section heading and includes job outlook information from BLS, it does not provide tuition per year, total program cost, fees per year, graduation rate, board pass rate, or employment rate specific to this DPT program. The page references links to 'Tuition & Fees' but the actual data is not present on this page.",,,,,,https://shps.lsuhs.edu/academics/graduate-programs/doctor-physical-therapy,https://shps.lsuhs.edu/academics/graduate-programs/doctor-physical-therapy/shreveport-residential-program,,,,,,,
139,Louisiana State Univ Health Sciences Center - New  Orleans,,Louisiana,http://alliedhealth.lsuhsc.edu/pt,url_found,3,high,https://alliedhealth.lsuhsc.edu/pt/docs/dptstudentfinancialfactsheet.pdf,Louisiana State Univ Health Sciences Center - New  Orleans DPT financial fact sheet,,,valid,,85495,2023-2024,18570,1250,,http://alliedhealth.lsuhsc.edu/pt,https://alliedhealth.lsuhsc.edu/pt/admissionrequirements.aspx,,,,,True,,
143,Husson University,,Maine,https://www.husson.edu/college-of-health-and-pharmacy/school-of-physical-therapy/,url_found,3,high,https://www.husson.edu/college-of-health/assets/2025-Husson-University_DPT_Financial_Fact_Sheet.pdf,Husson University DPT financial fact sheet,,2025,valid,,121225,2025,36720,5136,,https://www.husson.edu/college-of-health-and-pharmacy/school-of-physical-therapy/,https://www.husson.edu/college-of-health/school-of-physical-therapy/pt-job-placement?utm_medium=SEM&utm_source=Google&utm_campaign=physicaltherapygrad_search,,,,,,,
142,University of New England,,Maine,https://www.une.edu/wchp/pt,url_found,3,high,https://www.une.edu/sites/default/files/2025-10/2025-dpt-student-financial-fact-sheet.pdf,University of New England DPT financial fact sheet,,2025,valid,,195822,2025,62490,8614,,https://www.une.edu/wchp/pt,https://www.une.edu/wchp/pt,,,,,,,
144,University of Maryland - Baltimore,,Maryland,http://pt.umaryland.edu,url_found,3,high,https://www.umary.edu/sites/default/files/2022-07/DPT-student-financial-fact-sheet.pdf,University of Maryland - Baltimore DPT financial fact sheet,,2022,confirmed_landing,"Page is a general department overview/landing page with no financial or outcome data. Tuition, fees, total program cost, graduation rate, board pass rate, and employment rate are not present on this page.",,,,,,http://pt.umaryland.edu,https://pt.umaryland.edu/Graduate-Outcomes/,,,,,,,
145,University of Maryland - Eastern Shore,,Maryland,https://wwwcp.umes.edu/pt/,url_found,3,high,https://www.umary.edu/sites/default/files/2022-07/DPT-student-financial-fact-sheet.pdf,University of Maryland - Eastern Shore DPT financial fact sheet,,2022,confirmed_landing,"Page is a landing/overview page for UMES DPT program. While it mentions tuition and outcomes, actual financial data and specific outcome percentages are not provided on this page - they reference linked documents ('Click here for Estimated Costs and Financial Fact Sheet' and 'Click here for student outcomes'). Specific data points like tuition amount, fees, total cost, graduation rate, and board pass rate percentages are absent from this page itself.",,,,,,https://wwwcp.umes.edu/pt/,https://wwwcp.umes.edu/pt/student-achievements-outcomes/,,,,,,,
41,American International College,,Massachusetts,https://www.aic.edu/school-of-health-sciences/program/physical-therapy/,url_found,3,high,https://acapt.org/docs/default-source/default-document-library/doctor-of-physical-therapy-program-financial-fact-sheet-2020-2021.pdf?sfvrsn=46538fd8_2,American International College DPT financial fact sheet,,2020,confirmed_landing,"Page is for the correct school and DPT program, but financial data (tuition, fees, total program cost) is not present on this page. The page references a 'Student Financial Fact Sheet' with a link, but the actual financial data is on a separate linked page, not on this page itself. Outcome data is partially present (90% graduation rate, 88.9%/96.2% board pass rates, 100% employment rate), but since the tuition/fees data requires clicking to another page, this does not qualify as containing the full financial fact sheet data.",,,,,,https://www.aic.edu/school-of-health-sciences/program/physical-therapy/,http://www.aic.edu/academics/hs/physical_therapy,,,,,,,
35,Boston University,,Massachusetts,https://www.bu.edu/sargent/academics/departments-programs/physical-therapy-department/doctor-of-physical-therapy/,url_found,3,high,https://www.bu.edu/sargent/files/2024/11/2024-dpt-student-financial-fact-sheet.pdf,Boston University DPT financial fact sheet,,2024,valid,,190623,2024,70110,4239,,https://www.bu.edu/sargent/academics/departments-programs/physical-therapy-department/doctor-of-physical-therapy/,https://www.bu.edu/sargent/academics/departments-programs/physical-therapy-department/doctor-of-physical-therapy/accreditation,,,,,True,,
42,MCPHS University,,Massachusetts,https://www.mcphs.edu/academics/programs/physical-therapy-dpt,url_found,3,high,https://www.mcphs.edu/-/media/files/docs/academics/2023-dpt-student-financial-fact-sheet.pdf,MCPHS University DPT financial fact sheet,,2023,valid,,174422,2024-2025,55410,1675,,https://www.mcphs.edu/academics/programs/physical-therapy-dpt,https://www.mcphs.edu/academics/programs/physical-therapy-dpt/student-outcomes,https://www.mcphs.edu/academics/programs/physical-therapy-dpt,85.25,84.05,100.0,True,,
40,MGH Institute of Health Professions,,Massachusetts,https://www.mghihp.edu/health-rehabilitation-sciences/departments-programs/physical-therapy/dpt,url_found,3,high,https://www.mghihp.edu/sites/default/files/2024-09/abptrfe_financial-fact-sheet_mgh-ihp-2024.pdf,MGH Institute of Health Professions DPT financial fact sheet,,2024,fetch_failed,no_url,,,,,,https://www.mghihp.edu/health-rehabilitation-sciences/departments-programs/physical-therapy/dpt,https://www.mghihp.edu/health-rehabilitation-sciences/departments-programs/physical-therapy/dpt,,,,,,,
36,Northeastern University,,Massachusetts,,url_found,3,high,https://bouve.northeastern.edu/wp-content/uploads/2024/10/mgh-nu-financial-fact-sheet-2024.pdf,Northeastern University DPT financial fact sheet,,2024,fetch_failed,no_url,,,,,,,,,,,,,,
37,Simmons University,,Massachusetts,https://www.simmons.edu/graduate/academic-programs/graduate-and-certificate-programs/physical-therapy,url_found,3,high,https://www.simmons.edu/sites/default/files/2025-09/2025-dpt-student-financial-fact-sheet-simmons.pdf,Simmons University DPT financial fact sheet,,2025,valid,,171851,2025,58835,8432,,https://www.simmons.edu/graduate/academic-programs/graduate-and-certificate-programs/physical-therapy,https://www.simmons.edu/graduate/academic-programs/graduate-and-certificate-programs/physical-therapy,,,,,,,
38,Springfield College,,Massachusetts,http://springfield.edu/programs/physical-therapy-doctoral-degree,url_found,3,high,https://springfield.edu/sites/default/files/capte-financial-fact-sheet-2025-2026.pdf,Springfield College DPT financial fact sheet,,2025,valid,,152345,2025-2026,45181,4194,,http://springfield.edu/programs/physical-therapy-doctoral-degree,http://springfield.edu/programs/physical-therapy-doctoral-degree/outcomes,,,,,,,
43,Tufts University,,Massachusetts,,url_found,3,high,https://www.umt.edu/physical-therapy/tuition-fees1/umpt-financial-fact-sheet-2023-2024.pdf,Tufts University DPT financial fact sheet,,2023,fetch_failed,no_url,,,,,,,,,,,,,,
39,University of Massachusetts Lowell,,Massachusetts,https://www.uml.edu/Health-Sciences/PT/Graduate/,url_found,3,high,https://www.umt.edu/physical-therapy/tuition-fees1/umpt-financial-fact-sheet-2023-2024.pdf,University of Massachusetts Lowell DPT financial fact sheet,,2023,valid,,,2024-2025,,,,https://www.uml.edu/Health-Sciences/PT/Graduate/,https://www.uml.edu/Health-Sciences/PT/Graduate/,https://www.uml.edu/Health-Sciences/PT/Graduate/,98.6,91.0,100.0,,,
146,Andrews University,,Michigan,https://www.andrews.edu/chhs/srs/menudpt/index.html,url_found,3,high,https://www.andrews.edu/chhs/srs/zzz-pdf/2025-dpt-student-financial-fact-sheet.pdf,Andrews University DPT financial fact sheet,,2025,valid,,130088,2025,41940,1284,,https://www.andrews.edu/chhs/srs/menudpt/index.html,https://www.andrews.edu/chhs/srs/pt/entry-level-chhs/,,,,,,,
151,Central Michigan University,,Michigan,https://www.cmich.edu/academics/colleges/herbert-h-grace-a-dow-college-of-health-professions/departments/department-physical-therapy,url_found,3,high,https://www.cmich.edu/docs/default-source/colleges/college-of-health-professions/physical-therapy/20220708-doctorofphysicaltherapyfinancialfactsheet-001.pdf?sfvrsn=bac82023_6,Central Michigan University DPT financial fact sheet,,2022,valid,,120073,2025,33948,675,,https://www.cmich.edu/academics/colleges/herbert-h-grace-a-dow-college-of-health-professions/departments/department-physical-therapy,https://www.cmich.edu/academics/colleges/herbert-h-grace-a-dow-college-of-health-professions/degrees-programs/departments/department-physical-therapy/program-outcome-statistics,,,,,,,
152,Central Michigan University - EXPANSION PROGRAM  at Michigan Technological University,,Michigan,,url_found,3,high,https://medicine.umich.edu/sites/default/files/downloads/Peds_Michigan%20Medicine%20Residency%20and%20Fellowship%20Financial%20Fact%20Sheet%202023%20CW.pdf,Central Michigan University - EXPANSION PROGRAM  at Michigan Technological University DPT financial fact sheet,,2020,fetch_failed,no_url,,,,,,,,,,,,,,
154,Concordia University - Ann Arbor,,Michigan,www.cuaa.edu/academics/programs/doctor-physical-therapy,url_found,3,high,https://www.cuaa.edu/academics/programs/doctor-physical-therapy/_assets/financial-fact-sheet.pdf,Concordia University - Ann Arbor DPT financial fact sheet,,,fetch_failed,no_url,,,,,,www.cuaa.edu/academics/programs/doctor-physical-therapy,www.n/a.com,,,,,,,
147,Grand Valley State University,,Michigan,https://www.gvsu.edu/pt/,url_found,3,high,https://www.gvsu.edu/cms4/asset/8D477B3A-B7DC-AD72-BB198B341CA03C3E/2024-dpt-student-financial-fact-sheet-revised.pdf,Grand Valley State University DPT financial fact sheet,,2024,valid,,124043,2024,46859,300,,https://www.gvsu.edu/pt/,https://www.gvsu.edu/pt/program-effectiveness-data-111.htm,,,,,True,,
148,Oakland University,,Michigan,,url_found,3,high,https://www.capteonline.org/globalassets/capte-docs/faculty-and-program-resources/2025-dpt-student-financial-fact-sheet.docx,Oakland University physical therapy financial fact sheet,,2025,fetch_failed,no_url,,,,,,,,,,,,,,
149,University of Michigan - Flint,,Michigan,https://www.umflint.edu/graduateprograms/physical-therapy-entry-level-dpt,url_found,3,high,https://uwm.edu/rehabilitation-sciences-technology/wp-content/uploads/sites/627/2022/08/2025-dpt-student-financial-fact-sheet2-2.pdf,University of Michigan - Flint DPT financial fact sheet,,2022,valid,,68643,2025,24307,2103,,https://www.umflint.edu/graduateprograms/physical-therapy-entry-level-dpt,https://www.umflint.edu/graduateprograms/physical-therapy-entry-level-dpt,,,,,,,
150,Wayne State University,,Michigan,https://applebaum.wayne.edu/physical-therapy,url_found,3,high,https://applebaum.wayne.edu/physical-therapy/docs/dpt-cost.pdf,Wayne State University DPT financial fact sheet,,,valid,,116743,2024,32863,3308,,https://applebaum.wayne.edu/physical-therapy,https://applebaum.wayne.edu/physical-therapy/accreditation,,,,,True,,
153,Western Michigan University,,Michigan,https://wmich.edu/physicaltherapy,url_found,3,high,https://files.wmich.edu/s3fs-public/2025-11/2025-dpt-student-financial-fact-sheet_wmu_dpt.docx,Western Michigan University DPT financial fact sheet,,2025,confirmed_landing,"Page is a general overview/landing page for Western Michigan University's DPT program. While it mentions 'Financial fact sheet' and 'DPT Outcome Data' as links, the actual financial data (tuition, fees, total cost) and specific outcome metrics (graduation rate, board pass rate, employment rate) are not present on this page itself. The data appears to be on linked sub-pages that are not included in the provided content.",,,,,,https://wmich.edu/physicaltherapy,https://wmich.edu/physicaltherapy/dpt/outcomes,,,,,,,
155,College of St Scholastica,,Minnesota,https://www.css.edu/academics/programs/doctorate/doctor-of-physical-therapy-dpt/,url_found,3,high,https://www.bu.edu/sargent/files/2024/11/2024-dpt-student-financial-fact-sheet.pdf,College of St Scholastica DPT financial fact sheet,,2024,confirmed_landing,"This is the correct school's DPT program landing page, but detailed financial and outcome data are not present on this page. Specific financial information references a 'Financial Fact Sheet' link that would contain the actual data. While some outcome metrics are mentioned (95.9% overall licensure pass rate, 100% graduation rate for 2024-2025 cohorts, 98% employment rate for 2023-2024 cohorts), and tuition per credit is stated ($962/credit for 2025-26), the total program cost and complete fee breakdown are indicated to be on a separate Financial Fact Sheet page that is not provided here.",,,,,,https://www.css.edu/academics/programs/doctorate/doctor-of-physical-therapy-dpt/,https://www.css.edu/academics/programs/doctorate/doctor-of-physical-therapy-dpt/,,,,,,,
159,Concordia University - Saint Paul,,Minnesota,https://www.csp.edu/program/doctor-of-physical-therapy/,url_found,3,high,https://www.cuaa.edu/academics/programs/doctor-physical-therapy/_assets/financial-fact-sheet.pdf,Concordia University - Saint Paul DPT financial fact sheet,,,valid,,,2024-2025,,,,https://www.csp.edu/program/doctor-of-physical-therapy/,https://www.csp.edu/program/doctor-of-physical-therapy/,https://www.csp.edu/program/doctor-of-physical-therapy/,98.5,96.8,100.0,,,
156,Mayo Clinic School of Health Sciences,,Minnesota,https://college.mayo.edu/academics/health-sciences-education/physical-therapy-doctoral-program-minnesota/,url_found,3,high,https://www.utsouthwestern.edu/education/school-of-health-professions/training/assets/2024-2025-Financial-Fact-Sheet-Nuero-PT-Residency.pdf,Mayo Clinic School of Health Sciences DPT financial fact sheet,,2024,valid,,,2023-2025,,,,https://college.mayo.edu/academics/health-sciences-education/physical-therapy-doctoral-program-minnesota/,https://college.mayo.edu/academics/health-sciences-education/physical-therapy-doctoral-program-minnesota/,https://college.mayo.edu/academics/health-sciences-education/physical-therapy-doctoral-program-minnesota/,98.2,100.0,100.0,,,
158,St. Catherine University,,Minnesota,https://www.stkate.edu/academics/academic-programs/gc-physical-therapy,url_found,3,high,https://www.umt.edu/physical-therapy/tuition-fees1/umpt-financial-fact-sheet-2024-2025.pdf,St. Catherine University DPT financial fact sheet,,2024,valid,,111040,2025-26,27760,,,https://www.stkate.edu/academics/academic-programs/gc-physical-therapy,https://www.stkate.edu/accreditation/program-accreditation/dpt-ac,https://www.stkate.edu/academics/academic-programs/gc-physical-therapy,,,100.0,,,
157,University of Minnesota,,Minnesota,https://med.umn.edu/fmch/physical-therapy/doctor-physical-therapy,url_found,3,high,https://www.augie.edu/sites/default/files/documents/2025-12/2025-dpt-student-financial-fact-sheet.pdf,University of Minnesota DPT financial fact sheet,,2025,valid,,,2022-2024,,,,https://med.umn.edu/fmch/physical-therapy/doctor-physical-therapy,https://med.umn.edu/fmch/physical-therapy/doctor-physical-therapy,https://med.umn.edu/fmch/physical-therapy/doctor-physical-therapy,100.0,87.1,100.0,True,,
160,University of Mississippi at the Medical Center,,Mississippi,https://www.umc.edu/shrp/Physical%20Therapy/Physical-Therapy.html,url_found,3,high,https://umc.edu/shrp/Physical%20Therapy/Doctoral%20PT%20Degree/CAPTE.html,University of Mississippi at the Medical Center DPT financial fact sheet,,,valid,,77264,2025,24205,0,,https://www.umc.edu/shrp/Physical%20Therapy/Physical-Therapy.html,https://www.umc.edu/shrp/Physical%20Therapy/Doctoral%20PT%20Degree/Degree%20and%20Accreditation.html,,,,,,,
161,William Carey University,,Mississippi,https://www.wmcarey.edu/program/doctoral-physical-therapy,url_found,3,high,https://www.wmcarey.edu/_assets/documents/cohs/dpt-student-financial-fact-sheet.pdf,William Carey University DPT financial fact sheet,,,valid,,115330,2025-2026,36500,,,https://www.wmcarey.edu/program/doctoral-physical-therapy,https://www.wmcarey.edu/health-sciences/physical-therapy/accreditation,,,,,,,
