program_id,school_name,city,state,program_url,url_status,search_attempts,url_confidence,fact_sheet_url,search_query_used,scrape_notes,estimated_year,validation_status,rejection_reason,total_program_cost,data_year,tuition_per_year,fees_per_year,rediscovery_status,apta_program_url,outcomes_url,extracted_from_url,graduation_rate_pct,board_pass_rate_pct,employment_rate_pct,apta_landing_confirmed,program_length_months,extraction_notes
169,Graceland University,,Missouri,https://www.graceland.edu/programs/doctor-of-physical-therapy/,url_found,3,high,https://www.graceland.edu/wp-content/uploads/2024/11/2025-dpt-student-financial-fact-sheet.pdf,Graceland University DPT financial fact sheet,,2024,valid,,123872,2024-2025,52920,664,,https://www.graceland.edu/programs/doctor-of-physical-therapy/,https://www.graceland.edu/programs/doctor-of-physical-therapy/,,,,,,,
162,Maryville University of Saint Louis,,Missouri,http://www.maryville.edu/hp/doctor-of-physical-therapy,url_found,3,high,https://www.slu.edu/doisy/degrees/-pdf/pt-residency-financial-factsheet.pdf,Maryville University of Saint Louis DPT financial fact sheet,,,confirmed_landing,"This is the correct school's DPT program landing page, but it contains no financial or outcome data. While there are links to 'Tuition', 'Fees', and other resources, the actual data is not present on this page itself - it would be on linked sub-pages.",,,,,,http://www.maryville.edu/hp/doctor-of-physical-therapy,http://www.maryville.edu/hp/doctor-of-physical-therapy/program-features/,,,,,,,
168,Missouri State University,,Missouri,https://www.missouristate.edu/PhysicalTherapy/,url_found,3,high,https://www.missouristate.edu/SHCP/PhysicalTherapy/_Files/Missouri-State-2025-Financial-Fact-Sheet-2025.pdf,Missouri State University DPT financial fact sheet,,2025,valid,,67126,2025,16802,2073,,https://www.missouristate.edu/PhysicalTherapy/,https://www.missouristate.edu/physicaltherapy/doctorate/pass-rates.htm,,,,,,,
163,Rockhurst University,,Missouri,https://www.rockhurst.edu/physical-therapy,url_found,3,high,https://alliedhealth.lsuhsc.edu/pt/docs/dptstudentfinancialfactsheet.pdf,Rockhurst University DPT financial fact sheet,,,confirmed_landing,"Page is a general overview/landing page for Rockhurst University's DPT program with no financial data (tuition, fees, total cost) or outcome metrics (graduation rate, board pass rate, employment rate). Financial and detailed outcome information would be found on linked pages such as admissions requirements, cost pages, or outcomes pages.",,,,,,https://www.rockhurst.edu/physical-therapy,https://www.rockhurst.edu/physical-therapy/student-outcomes-accreditation/graduation-licensure-employment-rates,,,,,,,
164,Saint Louis University,,Missouri,https://www.slu.edu/doisy/degrees/undergraduate/physical-therapy-program/index.php,url_found,3,high,https://www.unlv.edu/sites/default/files/media/document/2023-11/UNLV-DPT-Financial-Factsheet-2023.pdf,Saint Louis University DPT financial fact sheet,,2023,confirmed_landing,"This is a general program overview/landing page for Saint Louis University's DPT program. While it correctly belongs to the DPT program at the right school, it contains no financial data (tuition, fees, total cost) or outcome metrics (graduation rate, board pass rate, employment rate). The page only provides descriptive information about the program structure and highlights.",,,,,,https://www.slu.edu/doisy/degrees/undergraduate/physical-therapy-program/index.php,https://www.slu.edu/doisy/degrees/undergraduate/physical-therapy-program/index.php,,,,,,,
167,Southwest Baptist University,,Missouri,https://www.sbuniv.edu/academics/programs/physical-therapy.php,url_found,3,high,https://www.sbuniv.edu/_resources/documents/health-professions/dpt-financial-fact-sheet.pdf,Southwest Baptist University DPT financial fact sheet,,,valid,,109200,2025,36400,446,,https://www.sbuniv.edu/academics/programs/physical-therapy.php,https://www.sbuniv.edu/academics/programs/physical-therapy.php,https://www.sbuniv.edu/academics/programs/physical-therapy.php,90.0,96.5,100.0,True,,
165,University of Missouri,,Missouri,https://healthsciences.missouri.edu/physical-therapy/doctor-of-physical-therapy/,url_found,3,high,https://www.missouristate.edu/SHCP/PhysicalTherapy/_Files/Missouri-State-2025-Financial-Fact-Sheet-2025.pdf,University of Missouri DPT financial fact sheet,,2025,confirmed_landing,"Page is a general overview/landing page for the University of Missouri DPT program. While it mentions cost and financial aid sections, the actual financial data (tuition, fees, total program cost) and specific outcome percentages are not displayed on this page - users must click links to 'Learn more about the professional cost of attendance' and 'Tuition' pages. The page only provides a general statement that DPT students do not pay out-of-state tuition fees, but no specific dollar amounts or detailed financial metrics are present. Employment rate (100%) and board pass rate (near 100%) are mentioned narratively but not as precise percentages with data years.",,,,,,https://healthsciences.missouri.edu/physical-therapy/doctor-of-physical-therapy/,https://healthsciences.missouri.edu/physical-therapy/doctor-of-physical-therapy/accreditation/,,,,,,,
166,Washington University in St Louis,,Missouri,https://pt.wustl.edu/education/doctor-of-physical-therapy/,url_found,3,high,https://pt.wustl.edu/app/uploads/2023/01/2022-2023-dpt-student-financial-fact-sheet.pdf,Washington University in St Louis DPT financial fact sheet,,2023,valid,,117122,2022-2023,40724,0,,https://pt.wustl.edu/education/doctor-of-physical-therapy/,https://pt.wustl.edu/education/doctor-of-physical-therapy/success-statistics/,,,,,True,,
170,University of Montana - Missoula,,Montana,https://www.umt.edu/physical-therapy/,url_found,3,high,https://www.umt.edu/physical-therapy/tuition-fees1/umpt-financial-fact-sheet-2024-2025.pdf,University of Montana - Missoula DPT financial fact sheet,,2024,valid,,55039,2024-2025,9241,2891,,https://www.umt.edu/physical-therapy/,https://www.umt.edu/physical-therapy/,,,,,,,
173,College of St. Mary,,Nebraska,https://www.csm.edu/academics/doctorate-physical-therapy,url_found,3,high,https://www.csm.edu/sites/default/files/2024-dpt-student-financial-fact-sheet-revised-9.3.2024%20CSM.pdf,College of St. Mary DPT financial fact sheet,,2024,valid,,100000,2024,36750,0,,https://www.csm.edu/academics/doctorate-physical-therapy,https://www.csm.edu/academics/doctor-physical-therapy-program-outcomes-0,,,,,True,,
172,Creighton University,,Nebraska,https://www.creighton.edu/pharmacy-ot-pt/physical-therapy,url_found,3,high,https://www.creighton.edu/sites/default/files/25-26-financial-fact-sheet-Geri-Res.pdf,Creighton University DPT financial fact sheet,,,confirmed_landing,"This is a landing/overview page for Creighton University's DPT program with general program information, but it does not contain any financial data (tuition, fees, total cost) or outcome metrics (graduation rate, board pass rate, employment rate). Financial and outcome data would be found on linked sub-pages.",,,,,,https://www.creighton.edu/pharmacy-ot-pt/physical-therapy,https://www.creighton.edu/academics/programs/physical-therapy-omaha,,,,,,,
171,University of Nebraska Medical Center,,Nebraska,https://www.unmc.edu/alliedhealth/academics/programs/pt/index.html,url_found,3,high,https://www.unmc.edu/mmi/_documents/education/fellowship-residency/abptrfe-program-financial-fact-sheet-2026.pdf,University of Nebraska Medical Center DPT financial fact sheet,,2026,confirmed_landing,"This is the main DPT program landing page for University of Nebraska Medical Center, which is the correct school. However, while it contains some outcome data (employment rate: 100%, graduation rate: 97%, board pass rate: 92-99%), it does NOT contain the financial data (tuition, fees, or total program cost). The page references a 'Financial Fact Sheet' link but does not display the actual financial information. The financial data would need to be extracted from the linked Financial Fact Sheet page, not this landing page.",,,,,,https://www.unmc.edu/alliedhealth/academics/programs/pt/index.html,https://www.unmc.edu/alliedhealth/academics/programs/pt/index.html,,,,,,,
175,Touro University - Nevada,,Nevada,https://tun.touro.edu/programs/physical-therapy/,url_found,3,high,https://tun.touro.edu/media/schools-and-colleges/tun/documents/2024-DPT-Student-Financial-Fact-Sheet_ADA.pdf,Touro University - Nevada DPT financial fact sheet,,2024,valid,,240237,2024,37665,5544,,https://tun.touro.edu/programs/physical-therapy/,https://tun.touro.edu/programs/physical-therapy/,,,,,True,,
174,"University of Nevada, Las Vegas",,Nevada,https://www.unlv.edu/pt,url_found,3,high,https://health.utah.edu/documents/dpt-financial-fact-sheet,"University of Nevada, Las Vegas DPT financial fact sheet",,,confirmed_landing,"This is the home/landing page for UNLV's DPT program. While it confirms the correct school and program, it does not contain the specific financial data (tuition per year, fees per year, total program cost) or outcome data (graduation rate, board pass rate, employment rate). The page mentions 'Program Outcome Data' and 'UNLV Financial Fact Sheet' as separate resources but does not display the actual data. Financial and outcome details would be on linked sub-pages.",,,,,,https://www.unlv.edu/pt,https://www.unlv.edu/pt/exam-rates,,,,,,,
176,Franklin Pierce University - NH,,New Hampshire,https://www.franklinpierce.edu/academics/programs/physical-therapy/index.html,url_found,3,high,https://franklinpierce.edu/academics/programs/physical-therapy/2024-2025-dpt-FPU-AZ-student-financial-fact-sheet.pdf,Franklin Pierce University - NH DPT financial fact sheet,,2024,confirmed_landing,"This is a landing/overview page for Franklin Pierce University's DPT program. While it mentions tuition information exists ('New Hampshire DPT Program Tuition: The current tuition rate is $14,270 per term plus a $185 comprehensive fee' and 'Arizona DPT Program Tuition: All information below is based on 2025-2026 pricing'), the actual detailed financial data, outcome rates (graduation rate, board pass rate, employment rate), and total program cost are not provided on this page. The content indicates these details are available via 'Learn more' links to sub-pages, not on this landing page itself.",,,,,,https://www.franklinpierce.edu/academics/programs/physical-therapy/index.html,https://www.franklinpierce.edu/academics/programs/physical-therapy/docs/DPT-Outcome-Data-NH.pdf,,,,,,,
177,Plymouth State University,,New Hampshire,https://www.plymouth.edu/doctor-physical-therapy/program/dpt/doctor-physical-therapy,url_found,3,high,https://www.plymouth.edu/sites/default/files/media/2025-10/2024-2025-dpt-student-financial-fact-sheet-PSU.pdf,Plymouth State University DPT financial fact sheet,,2025,valid,,92208,2025,27870,1802,,https://www.plymouth.edu/doctor-physical-therapy/program/dpt/doctor-physical-therapy,https://www.plymouth.edu/doctor-physical-therapy/program/dpt/doctor-physical-therapy,,,,,,,
181,Kean University,,New Jersey,https://www.kean.edu/academics/physical-therapy,url_found,3,high,https://www.kean.edu/media/2022-2023-dpt-student-financial-fact-sheet,Kean University DPT financial fact sheet,,2022,valid,,108131,2022-2023,28060,3545,,https://www.kean.edu/academics/physical-therapy,https://www.kean.edu/academics/school-physical-therapy/dpt-accreditation,,,,,True,,
178,"Rutgers, The State University of New Jersey",,New Jersey,https://shp.rutgers.edu/rehabilitation-movement-sciences/doctorate-in-physical-therapy/,url_found,3,high,https://shp.rutgers.edu/wp-content/uploads/Rutgers-DPT-Program-2025-DPT-Student-Financial-Fact-Sheet-by-Majsak-for-Webpage-Posting-10-13-25.pdf,"Rutgers, The State University of New Jersey DPT financial fact sheet",,2025,valid,,124521,2025,42596,6675,,https://shp.rutgers.edu/rehabilitation-movement-sciences/doctorate-in-physical-therapy/,https://shp.rutgers.edu/rehabilitation-movement-sciences/doctorate-in-physical-therapy/,,,,,,,
180,Seton Hall University,,New Jersey,http://www.shu.edu/academics/doctor-physical-therapy.cfm,url_found,3,high,https://acapt.org/docs/default-source/default-document-library/doctor-of-physical-therapy-program-financial-fact-sheet-2020-2021.pdf?sfvrsn=46538fd8_2,Seton Hall University DPT financial fact sheet,,2020,confirmed_landing,"This is a landing/overview page for Seton Hall's DPT program with no financial data (tuition, fees, total program cost). While it contains some outcome data (100% NPTE pass rate, 100% employment rate within 1 year), the financial information required for the data pipeline is not present on this page. A link to 'Learn More' about scholarships and financial aid suggests the detailed cost information is on a separate page.",,,,,,http://www.shu.edu/academics/doctor-physical-therapy.cfm,http://www.shu.edu/physical-therapy/outcomes.cfm,,,100.0,100.0,,,
179,Stockton University,,New Jersey,https://stockton.edu/graduate/physical-therapy.html,url_found,3,high,https://stockton.edu/graduate/documents/Stocktondptstudentfinancialfactsheet.pdf,Stockton University DPT financial fact sheet,,,valid,,111847,2025,24940,3368,,https://stockton.edu/graduate/physical-therapy.html,https://stockton.edu/graduate/physical-therapy.html,,,,,,,
182,University of New Mexico,,New Mexico,https://hsc.unm.edu/medicine/departments/ortho-rehab/physical-therapy/,url_found,3,high,https://www.umt.edu/physical-therapy/tuition-fees1/umpt-financial-fact-sheet-2023-2024.pdf,University of New Mexico DPT financial fact sheet,,2023,confirmed_landing,"This is a general program overview and history page for University of New Mexico's DPT program. While it contains some outcome metrics (graduation rate, board pass rate, employment rate), it lacks specific financial data (tuition, fees, total program cost). The financial information would typically be found on a separate admissions, tuition, or cost of attendance page.",,,,,,https://hsc.unm.edu/medicine/departments/ortho-rehab/physical-therapy/,https://hsc.unm.edu/medicine/departments/ortho-rehab/physical-therapy/,,,,,,,
29,Clarkson University,,New York,https://www.clarkson.edu/academics/schools-colleges/health/physical-therapy-department,url_found,3,high,https://www.clarkson.edu/sites/default/files/2024-01/2023-dpt-student-financial-fact-sheet.pdf,Clarkson University DPT financial fact sheet,,2024,valid,,101752,2024-2025,101752,9567,,https://www.clarkson.edu/academics/schools-colleges/health/physical-therapy-department,https://www.clarkson.edu/academics/majors-minors/dpt,https://www.clarkson.edu/academics/schools-colleges/health/physical-therapy-department,90.5,87.3,100.0,True,,
11,Columbia University,,New York,https://www.vagelos.columbia.edu/education/academic-programs/programs-physical-therapy/doctor-physical-therapy,url_found,3,high,https://www.vagelos.columbia.edu/education/academic-programs/programs-physical-therapy/doctor-physical-therapy/financial-fact-sheet,Columbia University DPT financial fact sheet,,,valid,,153055,2023-2024,40978,11459,,https://www.vagelos.columbia.edu/education/academic-programs/programs-physical-therapy/doctor-physical-therapy,https://www.ps.columbia.edu/education/academic-programs/programs-physical-therapy/doctor-physical-therapy/accreditation,,,,,True,,
23,D'youville College,,New York,,url_found,3,high,https://www.dyu.edu/sites/default/files/2025-07/Financial%20Fact%20Sheet%202025%20final%207_24.pdf,D'youville College DPT financial fact sheet,,2025,valid,,129395,2025,,1700,,,,,,,,,,
12,Daemen University,,New York,http://www.daemen.edu/academics/areas-study/physical-therapy,url_found,3,high,https://daemen.edu/sites/daemen/files/documents/dpt-student-financial-fact-sheet.pdf,Daemen University DPT financial fact sheet,,,valid,,128787,2025,42735,1195,,http://www.daemen.edu/academics/areas-study/physical-therapy,https://www.daemen.edu/academics/scott-bieler-college-health-professions/physical-therapy/student-outcomes,,,,,,,
31,Dominican University New York,,New York,https://www.duny.edu/physical-therapy/dpt-program/,url_found,3,high,https://www.duny.edu/wp-content/uploads/2021/06/PT-Financial-Fact-Sheet-2025.pdf,Dominican University New York DPT financial fact sheet,,2021,valid,,129639,2025,,1425,,https://www.duny.edu/physical-therapy/dpt-program/,https://www.duny.edu/physical-therapy/dpt-program/,,,,,,,
13,Hunter College (CUNY),,New York,https://hunter.cuny.edu/physical-therapy/,url_found,3,high,https://www2.hunter.cuny.edu/pending-migration/pt/2022-2023-hunter-college-dpt-financial-fact-sheet.pdf,Hunter College (CUNY) DPT financial fact sheet,,2022,valid,,51945,2022-2023,17300,463,,https://hunter.cuny.edu/physical-therapy/,https://hunter.cuny.edu/physical-therapy/cohort-profiles/,,,,,True,,
14,Ithaca College,,New York,http://www.ithaca.edu/pt,url_found,3,high,https://www.ithaca.edu/sites/default/files/2025-09/2025-dpt-student-financial-fact-sheet.pdf,Ithaca College DPT financial fact sheet,,2025,valid,,184047,2025,,,,http://www.ithaca.edu/pt,http://www.ithaca.edu/pt,,,,,,,
15,Long Island University - Brooklyn Campus,,New York,www.liu.edu/dpt,url_found,3,high,https://www.andrews.edu/chhs/srs/zzz-pdf/2025-dpt-student-financial-fact-sheet.pdf,Long Island University - Brooklyn Campus DPT financial fact sheet,,2025,fetch_failed,no_url,,,,,,www.liu.edu/dpt,www.liu.edu/dpt,,,,,,,
34,Marist College,,New York,,url_found,3,high,https://www.bu.edu/sargent/files/2024/11/2024-dpt-student-financial-fact-sheet.pdf,Marist College DPT financial fact sheet,,2024,fetch_failed,no_url,,,,,,,,,,,,,,
25,Mercy University,,New York,https://www.mercy.edu/academics/programs/doctor-physical-therapy-details,url_found,3,high,https://www.mercy.net/content/dam/mercy/en/pdf/Residency-Fellowship-Financial-Fact-Sheet.pdf,Mercy University DPT financial fact sheet,,,confirmed_landing,"This is a correct school and correct DPT program page, but it does not contain financial data (tuition, fees, total program cost) or outcome data (graduation rate, board pass rate, employment rate). The page is a program overview/landing page with general information about admissions, curriculum, and program highlights. Financial information would be found through the 'Financial Aid' link or other dedicated pages.",,,,,,https://www.mercy.edu/academics/programs/doctor-physical-therapy-details,https://www.mercy.edu/academics/programs/doctor-physical-therapy-details,,,,,,,
30,Nazareth University,,New York,https://www2.naz.edu/dept/physical-therapy,url_found,3,high,https://phhp.ufl.edu/wordpress/files/2025/11/2025-dpt-student-financial-fact-sheet-1-updated.docx,Nazareth University DPT financial fact sheet,,2025,valid,,,2023-2024,,,,https://www2.naz.edu/dept/physical-therapy,https://www2.naz.edu/dept/physical-therapy,https://www2.naz.edu/dept/physical-therapy,98.0,89.0,100.0,True,,
28,New York Institute of Technology,,New York,https://www.nyit.edu/academics/degrees/physical-therapy-dpt/,url_found,3,high,https://files.nyit.edu/files/health_professions/DPT_StudentFinancialFactSheet25.pdf,New York Institute of Technology DPT financial fact sheet,,,valid,,165347,2025,62580,2760,,https://www.nyit.edu/academics/degrees/physical-therapy-dpt/,https://www.nyit.edu/academics/health-professions/physical-therapy/about/outcomes-and-objectives/,,,,,,,
26,New York Medical College,,New York,https://www.nymc.edu/shsp/programs/physical-therapy/,url_found,3,high,https://files.nyit.edu/files/health_professions/DPT_StudentFinancialFactSheet_AY2324.pdf,New York Medical College DPT financial fact sheet,,,confirmed_landing,"Page is a general overview/landing page for NYMC's DPT program. While it mentions 'tuition' and 'financial fact sheet' as clickable links, the actual financial data (tuition per year, fees, total cost) is not present on this page itself. The page does contain some outcome data: 2-Year Average Licensure Pass Rate of 95.4% and 100% 2-Year Average Employment Rate are mentioned, but specific graduation rate, board pass rate percentage, and fees are not provided. The financial details require clicking to a linked sub-page.",,,,,,https://www.nymc.edu/shsp/programs/physical-therapy/,https://www.nymc.edu/shsp/programs/physical-therapy/outcomes/,,,,,,,
16,New York University,,New York,https://steinhardt.nyu.edu/degree/doctor-physical-therapy,url_found,3,high,https://www.unlv.edu/sites/default/files/media/document/2023-11/UNLV-DPT-Financial-Factsheet-2023.pdf,New York University DPT financial fact sheet,,2023,valid,,,2022-2023,,,,https://steinhardt.nyu.edu/degree/doctor-physical-therapy,https://steinhardt.nyu.edu/degree/doctor-physical-therapy,https://steinhardt.nyu.edu/degree/doctor-physical-therapy,97.6,98.6,100.0,True,,
17,Russell Sage College,,New York,https://www.sage.edu/academics/schools/health-sciences/physical-therapy-programs/,url_found,3,high,https://www.sage.edu/wp-content/uploads/2025/10/2025-dpt-student-financial-fact-sheet.docx,Russell Sage College DPT financial fact sheet,,2025,fetch_failed,no_url,,,,,,https://www.sage.edu/academics/schools/health-sciences/physical-therapy-programs/,https://www.sage.edu/academics/schools/health-sciences/physical-therapy-programs/,,,,,,,
19,SUNY (State University of NY) Downstate Health  Sciences University,,New York,https://www.downstate.edu/education-training/school-of-health-professions/programs/physical-therapy/index.html,url_found,3,high,https://www.downstate.edu/education-training/school-of-health-professions/programs/physical-therapy/_documents/2023_financial_fact_sheet.pdf,SUNY (State University of NY) Downstate Health  Sciences University DPT financial fact sheet,,2023,valid,,86215,2023,9282,691,,https://www.downstate.edu/education-training/school-of-health-professions/programs/physical-therapy/index.html,https://www.downstate.edu/education-training/school-of-health-professions/programs/physical-therapy/accreditation-outcomes.html,,,,,True,,
21,State University of NY Upstate Medical University,,New York,https://www.upstate.edu/chp/programs/physical-therapy/index.php,url_found,3,high,https://www.isu.edu/media/libraries/physical-therapy/Financial-fact-sheet-2025_2026-Final.pdf,State University of NY Upstate Medical University DPT financial fact sheet,,2025,valid,,63416,2025-2026,13954,10212,,https://www.upstate.edu/chp/programs/physical-therapy/index.php,https://www.upstate.edu/chp/programs/physical-therapy/accreditation-program-data.php,,,,,,,
20,Stony Brook University,,New York,https://healthprofessions.stonybrookmedicine.edu/programs/pt,url_found,3,high,https://healthprofessions.stonybrookmedicine.edu/sites/default/files/Financial%20Fact%20Sheet%202024.docx%20%281%29.pdf,Stony Brook University DPT financial fact sheet,,2020,valid,,112937,2023-2025,32518,3128,,https://healthprofessions.stonybrookmedicine.edu/programs/pt,https://healthprofessions.stonybrookmedicine.edu/programs/pt,https://healthprofessions.stonybrookmedicine.edu/programs/pt,97.0,91.5,100.0,True,,
33,Stony Brook University - Expansion Program at  Southampton Campus,,New York,,url_found,3,high,https://healthprofessions.stonybrookmedicine.edu/sites/default/files/Financial%20Fact%20Sheet%202024.docx%20%281%29.pdf,Stony Brook University - Expansion Program at  Southampton Campus DPT financial fact sheet,,2020,valid,,112937,2024,32518,3128,,,,,,,,,,
24,The College of Staten Island,,New York,https://www.csi.cuny.edu/academics-and-research/departments-programs/physical-therapy,url_found,3,high,https://acapt.org/docs/default-source/default-document-library/doctor-of-physical-therapy-program-financial-fact-sheet-2020-2021.pdf?sfvrsn=46538fd8_2,The College of Staten Island DPT financial fact sheet,,2020,confirmed_landing,"This is the correct school's DPT program landing page, but it does not contain financial data (tuition, fees, total program cost) or outcome metrics (graduation rate, board pass rate, employment rate). The page mentions 'CUNY tuition' generally and references 'Licensure Pass Rates and FAQs' as a link, but does not provide the actual data on this page.",,,,,,https://www.csi.cuny.edu/academics-and-research/departments-programs/physical-therapy,https://www.csi.cuny.edu/academics-and-research/departments-programs/physical-therapy/frequently-asked-questions,,,,,,,
22,Touro University,,New York,https://shs.touro.edu/programs/doctor-of-physical-therapy/,url_found,3,high,https://tun.touro.edu/media/schools-and-colleges/tun/documents/2024-DPT-Student-Financial-Fact-Sheet_ADA.pdf,Touro University DPT financial fact sheet,,2024,valid,,240237,2024,37665,5544,,https://shs.touro.edu/programs/doctor-of-physical-therapy/,https://shs.touro.edu/programs/doctor-of-physical-therapy/program-statistics/,,,,,True,,
32,Touro University - EXPANSION PROGRAM at NYC,,New York,,url_found,3,high,https://tun.touro.edu/media/schools-and-colleges/tun/documents/2024-DPT-Student-Financial-Fact-Sheet_ADA.pdf,Touro University - EXPANSION PROGRAM at NYC DPT financial fact sheet,,2024,valid,,240237,2024,37665,5544,,,,,,,,,,
18,"University at Buffalo, State University of New York",,New York,http://sphhp.buffalo.edu/rs/dpt/,url_found,3,high,https://publichealth.buffalo.edu/content/dam/sphhp/rehabilitation-science/UB%20DPT%202022-2023-dpt-student-financial-fact-sheet.pdf,"University at Buffalo, State University of New York DPT financial fact sheet",,2020,valid,,93108,2024,24390,2882,,http://sphhp.buffalo.edu/rs/dpt/,http://sphhp.buffalo.edu/rehabilitation-science/education/doctor-of-physical-therapy-dpt.html,http://sphhp.buffalo.edu/rs/dpt/,96.5,89.0,100.0,True,,
